Outlet,Brand,Products Name,Volume/Weight,Satchet/Units,Price in RM
LOTUS,100 PLUS,100 PLUS LEMON LIME (C) PET 1.5L,1.5,1,3.19
LOTUS,100 PLUS,100 PLUS ISOTONIC ZERO 1.5L,1.5,1,3.19
LOTUS,100 PLUS,100 PLUS ISOTONIC DRINK 1.5L,1.5,1,3.19
LOTUS,100 PLUS,100 PLUS ORIGINAL REDUCED SUGAR 1.5L,1.5,1,3.19
LOTUS,100 PLUS,100 PLUS ACTIVE REPLENISH 1L,1,1,2.95
LOTUS,100 PLUS,100PLUS ACTIVE REPLENISH 300MLX4,0.3,4,6.2
LOTUS,100 PLUS,100 PLUS ISOTONIC 325ML,0.325,1,1.65
LOTUS,100 PLUS,100 PLUS ISOTONIC 500ML,0.5,1,2.05
LOTUS,100 PLUS,100 PLUS LEMON LIME 500ML,0.5,1,2.05
LOTUS,100 PLUS,100 PLUS ISOTONIC DRINK 6X325ML,0.325,6,9.79
LOTUS,3 LEGS,3 LEGS COOLING WATER 200MLX6,0.2,6,8.19
LOTUS,3 LEGS,3 LEGS COOLING WATER 500ML,0.5,1,3.1
LOTUS,7UP,7UP BOTTLE 1.5L,1.5,1,3.19
LOTUS,7UP,7UP FREE 1.5L,1.5,1,3.39
LOTUS,7UP,7UP 320MLX4,0.32,4,6.79
LOTUS,7UP,7UP BTL 500ML,0.5,1,2.5
LOTUS,A&W,A&W SARSAPARILLA BOTTLE DRINK 1.5L,1.5,1,2.89
LOTUS,A&W,A&W SARSAPARILLA BOTTLE 500ML,0.5,1,2.39
LOTUS,ABBOTT,ABBOTT GLUCERNA VANILLA 850G,0.85,1,135.99
LOTUS,ABBOTT,ABBOTT PEDIASURE 10+ CHILDREN’S MILK FORMULA (VANILLA) 850G | FOR AGE 10~15 YEARS OLD,0.85,1,106.59
LOTUS,AH HUAT,AH HUAT WHITE COFFEE GOLD MEDAL FD 38G X 15S,0.038,15,16.99
LOTUS,AH HUAT,AH HUAT CLASSIC WHITE COFFEE 15SX28G,0.028,15,15.65
LOTUS,AH HUAT,AH HUAT WHITE COFFEE KOPITIAM CHARCOAL ROAST 15SX28G,0.028,15,15.65
LOTUS,AH HUAT,AH HUAT HAINAN TEA 15SX32G,0.032,15,16.5
LOTUS,AH HUAT,AH HUAT EXTRA RICH WHITE COFFEE 15SX36G,0.036,15,15.65
LOTUS,AH HUAT,AH HUAT LOW FAT NO SUGAR WHITE COFFEE 15 X 20G,0.02,15,15.65
LOTUS,AH HUAT,AH HUAT HERBAL TEA 310ML,0.31,1,2.25
LOTUS,AH HUAT,AH HUAT HERBAL TEA 310MLX6,0.31,6,13.2
LOTUS,AHMAD TEA,AHMAD TEA ENG B/FAST (TAGLESS)100TB,,100,18.25
LOTUS,AHMAD TEA,AHMAD TEA JASMINE GREEN TEA 100S,,100,18.9
LOTUS,AHMAD TEA,AHMAD TEA EARL GREY 100S,,100,19.99
LOTUS,AHMAD TEA,AHMAD TEA LEMON AND GINGER 20S,,20,9.2
LOTUS,AHMAD TEA,AHMAD TEA F/FLAV LMN+LIME 20S,,20,11.5
LOTUS,AHMAD TEA,AHMAD TEA F/FLAV MANGO 20S,,20,11.5
LOTUS,AHMAD TEA,AHMAD TEA FLAVOURED PEACH&PASSION FRUIT 20S,,20,11.5
LOTUS,AHMAD TEA,AHMAD TEA FLAVOURED STRAWBERRY 20S,,20,11.5
LOTUS,AHMAD TEA,AHMAD TEA CAMOMILE AND LEMONGRASS 20S,,20,11.89
LOTUS,AHMAD TEA,AHMAD TEA FRUIT TEA SELECTION 20S,,20,14.75
LOTUS,AHMAD TEA,AHMAD TEA JASMINE GREEN TEA 25S,,25,4.99
LOTUS,AHMAD TEA,AHMAD TEA LONDON BLEND 25S,,25,5.6
LOTUS,AHMAD TEA,AHMAD TEA GREEN TEA 25S,,25,5.99
LOTUS,AHMAD TEA,AHMAD TEA EARL GREY 25S,,25,5.99
LOTUS,AHMAD TEA,AHMAD TEA CEYLON 25S,,25,6.35
LOTUS,AHMAD TEA,AHMAD TEA LONDON FRUIT & HERB 20 FOIL WRAPPED TEA BAGS 20 X 2G,0.002,20,9.99
LOTUS,AHMAD TEA,AHMAD TEA ENG BREAKFAST TAGLESS 40S,,40,11.15
LOTUS,AIK CHEONG,AIK CHEONG KOPI O ECONOMY PACK 10GX100S,0.01,100,25.9
LOTUS,AIK CHEONG,AIK CHEONG COFFEE BAG 10GX20,0.01,20,6.99
LOTUS,AIK CHEONG,AIK CHEONG COFFEE BAG 2 IN 1 15G,0.015,1,9.2
LOTUS,AIK CHEONG,AIK CHEONG TEH TARIK COMBO 4IN1 15X40G,0.04,15,12.49
LOTUS,AIK CHEONG,AIK CHEONG COFFEE BAG 18GX12,0.018,12,6.99
LOTUS,AIK CHEONG,AIK CHEONG INSTANT COFFEEMIX 3 IN 1 18GX25,0.018,25,9.45
LOTUS,AIK CHEONG,AIK CHEONG 3IN1 INST COFFEE RICH 18GX25S,0.018,25,8.99
LOTUS,AIK CHEONG,AIK CHEONG 3IN1 INSTANT COFFEE BROWN SUGAR 18GX25S,0.018,25,8.99
LOTUS,AIK CHEONG,AIK CHEONG TEH TARIK KOSONG 25GX12S,0.025,12,12.49
LOTUS,AIK CHEONG,AIK CHEONG W/C KOSONG 30GX12S,0.03,12,12.4
LOTUS,AIK CHEONG,AIK CHEONG W/C ORIGINAL 38GX12S,0.038,12,12.4
LOTUS,AIK CHEONG,AIK CHEONG W/C LESS SWEET 38GX12S,0.038,12,12.4
LOTUS,AIK CHEONG,AIK CHEONG TEH TARIK KLASIK 38GX12S,0.038,12,12.4
LOTUS,AIK CHEONG,AIK CHEONG TEH TARIK HALIA 38GX12S,0.038,12,12.49
LOTUS,AIK CHEONG,AIK CHEONG W/C HAZELNUT 38GX12S,0.038,12,15.29
LOTUS,AKIF CAFE,AKIFCAFE MOCHA LATTE 3 IN 1 30GX10S,0.03,10,8.89
LOTUS,AKIF CAFE,AKIFCAFE LATTE 3 IN 1 30GX10S,0.03,10,8.89
LOTUS,AKIF CAFE,AKIFCAFE HAZELNUT LATTE 3 IN 1 30GX10S,0.03,10,8.89
LOTUS,AKIF CAFE,AKIFCAFE CAPPUCINO 3 IN 1 30GX10S,0.03,10,8.89
LOTUS,ALICAFE,ALICAFE TA GINSENG 20X30G,0.03,20,17.5
LOTUS,ALICAFE,ALICAFE TONGKAT ALI GINSENG ORI 250ML,0.25,1,2.59
LOTUS,ALICAFE,ALICAFE TONGKAT ALI GINSENG ORI 250MLX6,0.25,6,20.5
LOTUS,ALICAFE,ALICAFE TA KARAMEL 36GX15S,0.036,15,17.5
LOTUS,ALICAFE,ALICAFE TA LEBIH PEKAT 36GX15S,0.036,15,17.5
LOTUS,ALPINE,ALPINE NAT MINERAL WATER 1.5L,1.5,1,1.99
LOTUS,ALPINE,ALPINE MINERAL WATER 5.5L,5.5,1,7.8
LOTUS,ALPINE,ALPINE NAT MINERAL WATER 600ML,0.6,1,1.25
LOTUS,ALPINE,ALPINE SPORT NATURAL MINERAL WATER 750ML,0.75,1,2.59
LOTUS,AMEEN,AMEEN CORN 395ML,0.395,1,3.49
LOTUS,AMEEN,AMEEN ROSE 395ML,0.395,1,3.49
LOTUS,AMEEN,AMEEN LYCHEE 395ML,0.395,1,3.49
LOTUS,AMEEN,AMEEN GRAPE 395ML,0.395,1,3.49
LOTUS,AMEEN,AMEEN SARSI 395ML,0.395,1,3.49
LOTUS,ANGLOMAC,ANGLOMAC SKIM MILK POWDER 1KG,1,1,29.99
LOTUS,ANLENE,ANLENE ACTIFIT 3X 1KG,1,1,31.5
LOTUS,ANLENE,ANLENE GOLD 5X 1KG,1,1,37.9
LOTUS,ANLENE,ANLENE UHT LOW FAT 1L,1,1,7.25
LOTUS,ANLENE,ANLENE UHT LOW FAT 4X180ML,0.18,4,7.4
LOTUS,ANLENE,ANLENE UHT CHOC 4X180ML,0.18,4,7.4
LOTUS,ANLENE,ANLENE ACTIFIT 3X 600G,0.6,3,18.9
LOTUS,ANLENE,ANLENE ACTIFIT CHOCOLATE 3X 600G,0.6,3,18.9
LOTUS,ANLENE,ANLENE GOLD 5X 600G,0.6,5,23.9
LOTUS,ANLENE,ANLENE TOTAL 10 800G,0.8,1,54.9
LOTUS,ANRAMIN,ANRAMIN SUSU KAMBING ASLI 16S X 23G,0.023,16,27.99
LOTUS,ANRAMIN,ANRAMIN GOAT MILK WITH DATES 16S X 25G,0.025,16,24.99
LOTUS,ANRAMIN,ANRAMIN GOAT MILK WITH COFFEE 16S X 25G,0.025,16,24.99
LOTUS,APACHE,APACHE WHITE COFFEE 40GX15S,0.04,15,18.45
LOTUS,APACHE,APACHE IPOH PRE BLACK WHITE COFF 40GX15S,0.04,15,18.45
LOTUS,ATH,ATH AYATAKA GREEN TEA 1.5L,1.5,1,4.69
LOTUS,ATH,ATH AYATAKA GREEN TEA 300MLX4S,0.3,4,8.5
LOTUS,ATH,ATH AYATAKA GREEN TEA 500ML,0.5,1,2.7
LOTUS,ATH,ATH DA HONG PAO OOLONG TEA 500ML,0.5,1,2.7
LOTUS,AUTHENTIC TEA,AUTHENTIC TEA HOUSE OOLONG TEA 1.5L,1.5,1,5.7
LOTUS,BLUE DIAMOND,BLUE DIAMOND ALMOND CHOC MILK 180ML,0.18,1,3.74
LOTUS,BLUE DIAMOND,BLUE DIAMOND ALMOND LATTE MILK 180ML,0.18,1,3.74
LOTUS,BLUE DIAMOND,BLUE DIAMOND ALMOND MATCHA MILK 180ML,0.18,1,3.74
LOTUS,BLUE DIAMOND,BLUE DIAMOND ALMOND ORIGINAL MILK 180ML,0.18,1,3.74
LOTUS,BLUE DIAMOND,BLUE DIAMOND ALM UNSWTND ORI MILK 180ML,0.18,1,3.74
LOTUS,BLUE DIAMOND,BLUE DIAMOND ALMOND VANILLA MILK 180ML,0.18,1,3.74
LOTUS,BLUE DIAMOND,BLUE DIAMOND ALMOND UNSWT ORI MILK 946ML,0.946,1,17.99
LOTUS,BLUE DIAMOND,BLUE DIAMOND ALMOND ORIGINAL MILK 946ML,0.946,1,17.99
LOTUS,BLUE DIAMOND,BLUE DIAMOND ALMOND MATCHA MILK 946ML,0.946,1,17.99
LOTUS,BLUE DIAMOND,BLUE DIAMOND ALMOND VANILLA MILK 946ML,0.946,1,17.99
LOTUS,BLUE DIAMOND,BLUE DIAMOND ALMOND CHOCOLATE MILK 946ML,0.946,1,17.99
LOTUS,BLUE DIAMOND,BLUE DIAMOND ALMOND LATTE MILK 946ML,0.946,1,17.99
LOTUS,BLUE DIAMOND,BLUE DIAMOND BARISTA ALM UNSWT MILK 946ML,0.946,1,18.99
LOTUS,BOH,BOH DOUBLE CHAMBER TEABAGS 100S,,100,13.5
LOTUS,BOH,BOH TEH TARIK KURANG MANIS HALIA 12SX26G,0.026,12,14.3
LOTUS,BOH,BOH 3IN1 TEH TARIK KURANG MANIS 12SX27G,0.027,12,14.3
LOTUS,BOH,BOH 2IN1 TEA 20X11.5G,0.0115,20,10.99
LOTUS,BOH,BOH GREEN TEA LATTE 27GX12S,0.027,12,14.3
LOTUS,BOH,BOH 3 IN 1 INSTANT TEA MIX 30S,,30,13.95
LOTUS,BOH,BOH POTBAGS 40S,,40,5.3
LOTUS,BOH,BOH TEA LEAVE 500G,0.5,1,10.99
LOTUS,BOH,BOH TEA POTBAGS 80S,,80,8.79
LOTUS,BONCAFE,BONCAFE COLOMBIAN INSTANT COFFEE 100G,0.1,1,27.49
LOTUS,BONCAFE,BONCAFE COLUMBIAN DECAFFEINATED FREEZE 100G,0.1,1,32.89
LOTUS,BONCAFE,BONCAFE FILTER BAGS 1X4,,4,10.39
LOTUS,BONCAFE,BONCAFE ALL DAY COFFEE POWDER 200G,0.2,1,26.35
LOTUS,BONCAFE,BONCAFE EXPRESSO COFFEE POWDER 200G,0.2,1,26.35
LOTUS,BONCAFE,BONCAFE BRAZILIAN INSTANT COFFEE 200G,0.2,1,38.09
LOTUS,BUNDABERG,BUNDABERG PASSION FRUIT 375MLX4,0.375,4,20.85
LOTUS,BUNDABERG,BUNDABERG ROOT BEER 375MLX4,0.375,4,20.85
LOTUS,BUNDABERG,BUNDABERG TRADITIONAL LEMONADE 375MLX4,0.375,4,20.9
LOTUS,BUNDABERG,BUNDABERG GINGER BEER 375MLX4,0.375,4,20.9
LOTUS,CACTUS,CACTUS MINERAL WATER 350MLX12,0.35,12,6.5
LOTUS,CACTUS,CACTUS MINERAL WATER 5.5L,5.5,1,7.2
LOTUS,CACTUS,CACTUS MINERAL WATER 500MLX12,0.5,12,8.75
LOTUS,CACTUS,CACTUS MINERAL WATER 9.5L,9.5,1,9.85
LOTUS,CAP MASJID,CAP MASJID SERBUK TEH CAMPURAN 900G,0.9,1,14.9
LOTUS,CARNATION,CARNATION EVAPORATION CREAMER 390G,0.39,1,3.75
LOTUS,CC,CC LEMON 320MLX4,0.32,4,9.9
LOTUS,CHA PAI,CHA PAI LEMON PU ER TEA 500ML,0.5,1,2.99
LOTUS,CHA PAI,CHA PAI OOLONG PEACH TEA 500ML,0.5,1,2.99
LOTUS,CHA PAI,CHA PAI ICED LEMON TEA 500ML,0.5,1,2.99
LOTUS,CHA PAI,CHA PAI GRAPE OOLONG TEA 500ML,0.5,1,2.99
LOTUS,CHA PAI,CHA PAI JASMINE PAMELO TEA 500ML,0.5,1,2.99
LOTUS,CHA PAI,CHA PAI PAMELO GREEN TEA 500ML,0.5,1,2.99
LOTUS,CHA TRA MUE,CHA TRA MUE THAI GREEN MILK TEA 200G,0.2,1,12.9
LOTUS,CHA TRA MUE,CHA TRA MUE THAI COFFEE 400G,0.4,1,8.9
LOTUS,CHA TRA MUE,CHA TRA MUE THAI MILK TEA 400G,0.4,1,12.9
LOTUS,CHUPA CHUPS,CHUPA CHUPS GRAPE SPARKLING 345ML,0.345,1,3.74
LOTUS,CHUPA CHUPS,CHUPA CHUPS ORANGE SPARKLING 345ML,0.345,1,3.74
LOTUS,CHUPA CHUPS,CHUPA CHUPS STRAWBERRY SPARKLING 345ML,0.345,1,3.74
LOTUS,COCA-COLA,COCA-COLA VANILLA 1.5L,1.5,1,2.89
LOTUS,COCA-COLA,COCA-COLA VANILLA 1.5L,1.5,1,2.89
LOTUS,COCA-COLA,COKE ZERO SUGAR 1.5L,1.5,1,2.89
LOTUS,COCA-COLA,COKE ZERO SUGAR 1.5L,1.5,1,2.89
LOTUS,COCA-COLA,COKE MINI 180MLX6,0.18,6,10.8
LOTUS,COCA-COLA,COCA-COLA RASA ASLI CAN 320ML,0.32,1,1.7
LOTUS,COCA-COLA,COKE VANILLA 320ML,0.32,1,2.3
LOTUS,COCA-COLA,COKE LESS CALORIES RASA ASLI 320MLX24,0.32,24,46.9
LOTUS,COCA-COLA,COCA-COLA RASA ASLI 320MLX4,0.32,4,6.95
LOTUS,COCA-COLA,COKE ZERO 320MLX4,0.32,4,6.95
LOTUS,COCA-COLA,COCA-COLA RASA ASLI 500ML,0.5,1,2.45
LOTUS,COCA-COLA,COKE ZERO 500ML,0.5,1,2.5
LOTUS,COFFEE,COFFEE MATE 450G FOC 50G,0.5,1,9.4
LOTUS,COOL RHINO,COOL RHINO 350ML,0.35,1,2.69
LOTUS,COOL RHINO,COOL RHINO O2 350ML,0.35,1,2.9
LOTUS,COOL RHINO,COOL RHINO 350MLX4,0.35,4,11.39
LOTUS,COOL RHINO,COOL RHINO O2 350MLX4,0.35,4,12.79
LOTUS,DAIRY CHAMP,DAIRY CHAMP EVAPORATED CREAMER 390G,0.39,1,3.1
LOTUS,DAIRY CHAMP,DAIRY CHAMP SWEETENED CREAMER 500G,0.5,1,3.49
LOTUS,DATE CROWN,DATE CROWN DATE SYRUP 400G,0.4,1,9.99
LOTUS,DAVIDOFF,DAVIDOFF CAFE-RICH AROMA 100G,0.1,1,30.99
LOTUS,DAVIDOFF,DAVIDOFF CAFE-FINE AROMA 100G,0.1,1,30.99
LOTUS,DAVIDOFF,DAVIDOFF CAFE-ESPRESSO 100G,0.1,1,30.99
LOTUS,DESA,DESA DRINKING WATER 1.5L,1.5,1,1.25
LOTUS,DESA,DESA DRINKING WATER 5.5L,5.5,1,6.99
LOTUS,DESA,DESA DRINKING WATER 500ML,0.5,1,0.75
LOTUS,DILMAH,DILMAH EXCPT ROSE W FRCH VANILLA 20SX2G,0.002,20,14.5
LOTUS,DILMAH,DILMAH EXCPT FRAGANT JASMINE GT 20SX2G,0.002,20,14.5
LOTUS,DILMAH,DILMAH EXCPT BERRY SENSATION 20SX2G,0.002,20,14.55
LOTUS,DILMAH,DILMAH EXCPT ELEGANT EARL GREY 20SX2G,0.002,20,14.55
LOTUS,DILMAH,DILMAH EXCPT GENTLE MINTY GT 20SX2G,0.002,20,14.55
LOTUS,DILMAH,DILMAH CEYLON GT LEMONGRASS 20SX2G,0.002,20,14.85
LOTUS,DILMAH,DILMAH CEYLON GT CHAMOMILE 20SX2G,0.002,20,14.85
LOTUS,DILMAH,DILMAH PURE CAMOMILE 20X1.5G,0.0015,20,12.99
LOTUS,DILMAH,DILMAH PURE PEPPERMINT 20X1.5G,0.0015,20,12.99
LOTUS,DILMAH,DILMAH PURE CEYLON GREEN TEA WITH GINGER 20 TEA BAGS 40G,0.04,20,14.85
LOTUS,DKE,DKE PURE GOAT MILK POWDER 18GX15S,0.018,15,23.52
LOTUS,DL UHT,DL UHT MILKY MARVEL CHOCOLATE 125MLX4,0.125,4,4.99
LOTUS,DL UHT,DL UHT MILKY MARVEL STRAWBERRY 125MLX4,0.125,4,4.99
LOTUS,DOLCE GUSTO,DOLCE GUSTO CAFE AU LAIT 160G,0.16,1,33.1
LOTUS,DOLE,DOLE PINEAPPLE TROPICAL JUICE 240ML,0.24,1,3.9
LOTUS,DOLE,DOLE PINEAPPLE MANGO JUICE 240ML,0.24,1,3.9
LOTUS,DOLE,DOLE PINEAPPLE ORANGE JUICE 240ML,0.24,1,3.9
LOTUS,DOLE,DOLE PINEAPPLE ORANGE BANANA JUICE 240ML,0.24,1,3.9
LOTUS,DOLE,DOLE 100% PINEAPPLE JUICE 240ML,0.24,1,3.9
LOTUS,DONGA,DONGA APPLE DEMISODA 250ML,0.25,1,2.99
LOTUS,DONGA,DONGA LEMON DEMISODA 250ML,0.25,1,2.99
LOTUS,DONGA,DONGA GRAPE DEMISODA 250ML,0.25,1,2.99
LOTUS,DONGA,DONGA PEACH DEMISODA 250ML,0.25,1,2.99
LOTUS,DRINHO,DRINHO ICE PEACH TEA 250ML X 6,0.25,6,4.9
LOTUS,DRINHO,DRINHO CHRYSANTHEMUM TEA 1L,1,1,2.69
LOTUS,DRINHO,DRINHO SOYA BEAN 1L,1,1,2.69
LOTUS,DRINHO,DRINHO WINTER MELON 1L,1,1,2.69
LOTUS,DRINHO,DRINHO LYCHEE 1L,1,1,2.69
LOTUS,DRINHO,DRINHO SOYA MILK CORN 1L,1,1,3.25
LOTUS,DRINHO,DRINHO MANGO DRINK 250MLX6,0.25,6,4.9
LOTUS,DRINHO,DRINHO SOYA BEAN 250MLX6,0.25,6,4.9
LOTUS,DRINHO,DRINHO SUGARCANE 250MLX6,0.25,6,4.9
LOTUS,DRINHO,DRINHO CHRYSANTHEMUM TEA 250MLX6,0.25,6,4.9
LOTUS,DRINHO,DRINHO WINTER MELON 250MLX6,0.25,6,4.9
LOTUS,DRINHO,DRINHO ORANGE 250MLX6,0.25,6,4.9
LOTUS,DRINHO,DRINHO LYCHEE 250MLX6,0.25,6,4.9
LOTUS,DRINHO,DRINHO CORN SOYA MILK 250MLX6,0.25,6,6.09
LOTUS,DUTCH LADY,DUTCH LADY UHT MILKY MARVEL FULL CREAM 125MLX4,0.125,4,4.99
LOTUS,DUTCH LADY,DUTCH LADY UHT MILKY FROZEN STRAWBERRY 125MLX4,0.125,4,4.99
LOTUS,DUTCH LADY,DUTCH LADY UHT MILKY FROZEN STRAWBERRY 125MLX4,0.125,4,4.99
LOTUS,DUTCH LADY,DUTCH LADY UHT MILK MARVEL CHOCOLATE 125MLX8,0.125,8,8.9
LOTUS,DUTCH LADY,DUTCH LADY UHT MILKY FROZEN CHOCOLATE TRIPLE PACK 125MLX8,0.125,8,8.9
LOTUS,DUTCH LADY,D/LADY UHT COOKIES CREAM 180MLX4,0.18,4,6.45
LOTUS,DUTCH LADY,D/LADY UHT VANILLA ICE CREAM 180MLX4,0.18,4,6.45
LOTUS,DUTCH LADY,DUTCH LADY UHT STRAWBERRY MILK 1L,1,1,5.89
LOTUS,DUTCH LADY,DUTCH LADY UHT CHOCOLATE MILK 1L,1,1,5.89
LOTUS,DUTCH LADY,DUTCH LADY UHT LOW FAT MILK 1L,1,1,5.89
LOTUS,DUTCH LADY,DUTCH LADY FULL CREAM UHT MILK 1L,1,1,5.89
LOTUS,DUTCH LADY,DUTCH LADY FULL CREAM UHT MILK 1LX12,1,12,69.48
LOTUS,DUTCH LADY,D/LADY UHT MILK COFFEE 200MLX6,0.2,6,9.6
LOTUS,DUTCH LADY,DUTCH LADY FULL CREAM UHT MILK 200MLX6,0.2,6,9.6
LOTUS,DUTCH LADY,DUTCH LADY LOW FAT UHT MILK 200MLX6,0.2,6,9.6
LOTUS,DUTCH LADY,DUTCH LADY UHT BANANA FLAVOURED MILK 200MLX6,0.2,6,9.65
LOTUS,DUTCH LADY,DUTCH LADY UHT CHOCOLATE MILK 200ML X 6S,0.2,6,9.6
LOTUS,DUTCH LADY,DUTCH LADY UHT CHOCOLATE MILK 200ML X 6S,0.2,6,9.6
LOTUS,DUTCH LADY,DUTCH LADY CHOCOLATE DRINK 900G,0.9,1,19.95
LOTUS,ENSURE,ENSURE GOLD VANILLA YBG 400G,0.4,1,59.9
LOTUS,ENSURE,ENSURE GOLD WHEAT YEAST BETA GLUCAN 400G,0.4,1,59.9
LOTUS,ENSURE,ENSURE GOLD PLANT-BASED 400G,0.4,1,59.9
LOTUS,ENSURE,ENSURE GOLD COFFEE YBG 800G,0.8,1,103.9
LOTUS,ENSURE,ENSURE GOLD VANILLA YBG 800G,0.8,1,103.9
LOTUS,ENSURE,ENSURE GOLD WHEAT YBG 800G,0.8,1,103.9
LOTUS,ENSURE,ENSURE GOLD ALMOND FLAVOURED PLANT-BASED 850G,0.85,1,103.9
LOTUS,EURY,EURY CAFE 25GX20S,0.025,20,17.99
LOTUS,EVERVESS,EVERVESS GINGER ALE 320ML,0.32,1,1.79
LOTUS,EVERVESS,EVERVESS TONIC 320ML,0.32,1,1.79
LOTUS,EVERVESS,EVERVESS SODA 320ML,0.32,1,1.79
LOTUS,EVERYDAY,EVERYDAY FILLED MILK POWDER 250G,0.25,1,12.5
LOTUS,EVERYDAY,EVERYDAY FILLED MILK POWDER 800G,0.8,1,27.3
LOTUS,EVIAN,EVIAN MINERAL WATER 1.5L,1.5,1,10.6
LOTUS,EVIAN,EVIAN NOMAD MINERAL WATER 750ML,0.75,1,8.2
LOTUS,F&N,F&N OUTRAGEOUS ORANGE CARBONATED DRINK 1.5L,1.5,1,3.45
LOTUS,F&N,F&N SARSI CARBONATED DRINK 1.5L,1.5,1,3.45
LOTUS,F&N,F&N SEASONS ICE LEMON TEA (A) PET 1.5L,1.5,1,3.95
LOTUS,F&N,FN GRAPE 1.5L,1.5,1,3.45
LOTUS,F&N,FN FRUITADE 1.5L,1.5,1,3.45
LOTUS,F&N,FN ZAPPEL 1.5L,1.5,1,3.45
LOTUS,F&N,FN ICE CREAM SODA 1.5L,1.5,1,3.45
LOTUS,F&N,FN STRAWBERRY 1.5L,1.5,1,3.45
LOTUS,F&N,F&N SEASONS SOYA BEAN 1L,1,1,2.5
LOTUS,F&N,F&N SEASONS CHRYSTHEMUM DRINK 1L,1,1,2.5
LOTUS,F&N,F&N SEASONS SOYA BEAN 250MLX6,0.25,6,6.2
LOTUS,F&N,FN SEASONS ICE LEMON TEA 250MLX6,0.25,6,6.2
LOTUS,F&N,FN SEASONS CHRYSTHEMUM 250MLX6,0.25,6,6.2
LOTUS,F&N,FN TEH TARIK L/SWEET PET 270M,0.27,1,12.59
LOTUS,F&N,FN TEH TARIK PET 270MLX4,0.27,4,12.59
LOTUS,F&N,F&N ROSE CORDIAL SYRUP 2L,2,1,12.45
LOTUS,F&N,F&N GRAPE CORDIAL 2L,2,1,12.45
LOTUS,F&N,F&N CORDIAL RUT B 2L,2,1,12.45
LOTUS,F&N,F&N SARSAPARILLA CORDIAL 2L,2,1,12.45
LOTUS,F&N,F&N ROSE CORDIAL SYRUP 2L,2,1,12.45
LOTUS,F&N,F&N SEASONS GRASS JELLY (CINCAU) 300ML,0.3,1,1.5
LOTUS,F&N,F&N CLUB SODA WATER 325ML,0.325,1,1.75
LOTUS,F&N,F&N ED TONIC CAN 325ML,0.325,1,1.9
LOTUS,F&N,FN GRAPE CAN 325ML,0.325,1,1.75
LOTUS,F&N,FN ICE CRM SODA 325ML,0.325,1,1.75
LOTUS,F&N,FN STRAWBERRY CAN 325ML,0.325,1,1.75
LOTUS,F&N,FN SARSI CAN 325ML,0.325,1,1.75
LOTUS,F&N,F&N EVAPORATED CREAMER 390G,0.39,1,3.69
LOTUS,F&N,F&N CONDENSED FULL CREAM MILK 392G,0.392,1,6.1
LOTUS,F&N,F&N SWEETENED CREAMER TEH TARIK 500G,0.5,1,3.79
LOTUS,F&N,F&N SWEETENED CONDENSED FILLED MILK 500G,0.5,1,5.25
LOTUS,F&N,FN SWEETENED CREAMER HICAL 500G,0.5,1,3.9
LOTUS,F&N,FN VITAMINISED SWEETENED CREAMER 500G,0.5,1,3.99
LOTUS,FAMOUS HOUSE,FAMOUS HOUSE ORANGE JUICE 485ML,0.485,1,3.44
LOTUS,FAMOUS HOUSE,FAMOUS HOUSE GUAVA JUICE 500ML,0.5,1,3.44
LOTUS,FAMOUS HOUSE,FAMOUS HOUSE MIXED FRUIT JUICE 500ML,0.5,1,3.44
LOTUS,FAMOUS HOUSE,FAMOUS HOUSE MANGO JUICE 500ML,0.5,1,3.44
LOTUS,FAMOUS HOUSE,FAMOUS HOUSE PEACH JUICE 500ML,0.5,1,3.44
LOTUS,FAMOUS HOUSE,FAMOUS HOUSE GRAPE JUICE 500ML,0.5,1,3.44
LOTUS,FAMOUS HOUSE,FAMOUS HOUSE BANANA MILK 500ML,0.5,1,3.97
LOTUS,FAMOUS HOUSE,FAMOUS HOUSE MANGO MILK 500ML,0.5,1,3.97
LOTUS,FAMOUS HOUSE,FAMOUS HOUSE PAPAYA MILK 500ML,0.5,1,3.97
LOTUS,FANTA,FANTA ORANGE 1.5L,1.5,1,2.89
LOTUS,FANTA,FANTA S/BERRY 1.5L,1.5,1,2.89
LOTUS,FANTA,FANTA GRAPE 1.5L,1.5,1,2.89
LOTUS,FANTA,FANTA ORANGE 500ML,0.5,1,1.8
LOTUS,FANTA,FANTA STRAWBERRY 500ML,0.5,1,1.8
LOTUS,FARM FRESH,FARM FRESH UHT SOY MILK ORI 1L,1,1,6.5
LOTUS,FARM FRESH,FARM FRESH UHT CHOCOLATE MILK 1L,1,1,6.9
LOTUS,FARM FRESH,FARM FRESH UHT ALMOND MILK 1L,1,1,13
LOTUS,FARM FRESH,FARM FRESH UHT ALMOND UNSWEET 1L,1,1,13
LOTUS,FARM FRESH,FARM FRESH UHT OAT MILK 1L,1,1,13
LOTUS,FARM FRESH,YARRA FULL CREAM MILK UHT 1L,1,1,5.89
LOTUS,FARM FRESH,YARRA CHOCOLATE MILK UHT 1L,1,1,5.89
LOTUS,FARM FRESH,YARRA STRAWBERRY MILK UHT 1L,1,1,5.89
LOTUS,FARM FRESH,FARM FRESH UHT SOY MILK ORI 200MLX4,0.2,4,6.8
LOTUS,FARM FRESH,FARM FRESH UHT CHOC MILK WT SOY 200MLX4,0.2,4,6.8
LOTUS,FARM FRESH,FARM FRESH UHT CHOCOLATE MILK 200MLX4,0.2,4,9.95
LOTUS,FARM FRESH,FARM FRESH UHT YOG DRK M/BERRIES 200MLX4,0.2,4,9.95
LOTUS,FARM FRESH,FARM FRESH UHT OAT MILK 200MLX4,0.2,4,14
LOTUS,FARM FRESH,FARM FRESH UHT ALMOND MILK 200MLX4,0.2,4,14
LOTUS,FARM FRESH,FARM FRESH UHT ALMOND UNSWEET 200MLX4,0.2,4,14
LOTUS,FARM FRESH,YARRA FULL CREAM MILK UHT 200MLX4,0.2,4,6.8
LOTUS,FARM FRESH,YARRA CHOCOLATE MILK UHT 200MLX4,0.2,4,6.8
LOTUS,FARM FRESH,YARRA STRAWBERRY MILK UHT 200MLX4,0.2,4,6.8
LOTUS,FERNLEAF,FERNLEAF FAMILY MILK POWDER 1.8KG,1.8,1,41.99
LOTUS,FERNLEAF,FERNLEAF FULL CREAM 1.8KG,1.8,1,52.5
LOTUS,FERNLEAF,FERNLEAF FAMILY MILK 300G,0.3,1,9.5
LOTUS,FERNLEAF,FERNLEAF FULL CREAM 300G,0.3,1,11.9
LOTUS,FERNLEAF,FERNLEAF FAMILY MILK 550G,0.55,1,14.9
LOTUS,FERNLEAF,FERNLEAF FULL CREAM 550G,0.55,1,18.95
LOTUS,FERNLEAF,FERNLEAF PROTEIN PLUS 800G,0.8,1,31
LOTUS,FERNLEAF,FERNLEAF FAMILY MILK 900G,0.9,1,23.2
LOTUS,FERNLEAF,FERNLEAF FULL CREAM 900G,0.9,1,28.75
LOTUS,FRENCHE ROAST,FRENCHE ROAST IDG TIRAMISU LATTE 18SX23G,0.023,18,11.5
LOTUS,FRENCHE ROAST,FRENCHE ROAST IDG SLT CRM LATTE 20SX23G,0.023,20,11.5
LOTUS,FRENCHE ROAST,FRENCHE ROAST FREEZE DRIED MICROGROUND PREMIX COFFEE SIGNATURE BLEND 28X19G,0.019,28,11.5
LOTUS,FUZE TEA,FUZE TEA ICE G/TEA JASMINE 1.5L,1.5,1,4.69
LOTUS,FUZE TEA,FUZE TEA ICE PASSION FRUIT TEA 1.5L,1.5,1,4.69
LOTUS,FUZE TEA,FUZE TEA ICE LEMON TEA 1.5L,1.5,1,4.69
LOTUS,FUZE TEA,FUZE TEA MANGO CHAMOMILE 1.5L,1.5,1,5.99
LOTUS,FUZE TEA,FUZE TEA ICE LEMON TEA 500ML,0.5,1,1.95
LOTUS,FUZE TEA,FUZE TEA JASMINE GREEN TEA 500ML,0.5,1,1.95
LOTUS,FUZE TEA,FUZE TEA ICE PASSION FRUIT TEA 500ML,0.5,1,1.95
LOTUS,FUZE TEA,FUZE TEA MANGO CHAMOMILE 500ML,0.5,1,2.39
LOTUS,GENKI FOREST,GENKI FOREST SPKLG CALAMANSI JUC 480ML,0.48,1,3.97
LOTUS,GENKI FOREST,GENKI FOREST SPARKLING PEACH JUC 480ML,0.48,1,3.97
LOTUS,GENKI FOREST,GENKI FOREST SPARKLING LYCHEE JUC 480ML,0.48,1,3.97
LOTUS,GENKI FOREST,GENKI FOREST SPARKLING BLK GRAPE JUC 480ML,0.48,1,3.97
LOTUS,GLACEAU,GLACEAU VIT. WATER ESSENTIAL 500ML,0.5,1,3.9
LOTUS,GLACEAU,GLACEAU VIT. WATER RESTORE 500ML,0.5,1,3.9
LOTUS,GLACEAU,GLACEAU VIT. WATER TRIPLE X 500ML,0.5,1,3.9
LOTUS,GLUCERNA,GLUCERNA CHOCOLATE 800G,0.8,1,135.99
LOTUS,GOLD COIN,GOLD COIN KOPI TEH TARIK SWEETENED CREAMER 500G,0.5,1,3.09
LOTUS,GOLD COIN,GOLD COIN SWEETENED CREAMER 500G,0.5,1,3.49
LOTUS,GOODDAY,GOODDAY FULL CREAM UHT MILK 1L,1,1,5.95
LOTUS,GOODDAY,GOODDAY UHT MILK CHOCOLATE 1L,1,1,5.95
LOTUS,GOODDAY,GOODDAY UHT MILK STRAWBERRY 1L,1,1,6.6
LOTUS,GOODDAY,GOODDAY UHT MILK LOW FAT 1L,1,1,6.6
LOTUS,GOODDAY,GOODDAY UHT CHARGE (5+1) X 200ML,0.2,6,10.25
LOTUS,GOODDAY,GOODDAY UHT MILK LOW FAT 200MLX6,0.2,6,10.1
LOTUS,GOODDAY,GOODDAY UHT MILK STRAWBERRY 200MLX6,0.2,6,10.1
LOTUS,GOODDAY,GOODDAY CHOCOLATE UHT MILK 200MLX6,0.2,6,10.1
LOTUS,GOODDAY,GOODDAY CHOCOLATE UHT MILK 200MLX6,0.2,6,10.1
LOTUS,HAITAI,HAITAI BON BON GRAPE CAN JUICE 238ML,0.238,1,2.99
LOTUS,HALAGEL,HALAGEL PREMIX COFFEE ROCK SALT 25GX15S,0.025,15,14.49
LOTUS,HANG TUAH,HANG TUAH KOPI 2 IN 1 20X25G (B),0.025,20,9.69
LOTUS,HANG TUAH,HANG TUAH KOPI 2 IN 1 20X25G (H),0.025,20,9.69
LOTUS,HANG TUAH,HANG TUAH KOPI O 10GX20S,0.01,20,9.85
LOTUS,HANG TUAH,HANG TUAH COFFEE PWD MIX 1KG,1,1,19.19
LOTUS,HANG TUAH,HANG TUAH KOPI 3 IN 1 20GX20S,0.02,20,15.7
LOTUS,HANG TUAH,HANG TUAH SERBUK KOPI CAMPURAN(B)200G,0.2,1,4.4
LOTUS,HANG TUAH,HANG TUAH SERBUK KOPI CAMPURAN(H)200G,0.2,1,4.4
LOTUS,HARADA,HARADA JAPANESE TEA BAGS 2GX50S,0.002,50,24.99
LOTUS,HARADA,HARADA BROWN RICE N GREEN TEA 2GX50S,0.002,50,24.99
LOTUS,HATAKOSEN RAMUNE,HATAKOSEN RAMUNE SODA-STRAWBERRY 200ML,0.2,1,3.74
LOTUS,HATAKOSEN RAMUNE,HATAKOSEN RAMUNE SODA BLUEBERRY 200ML,0.2,1,3.74
LOTUS,HATAKOSEN RAMUNE,HATAKOSEN RAMUNE SODA ORANGE 200ML,0.2,1,3.74
LOTUS,HATAKOSEN RAMUNE,HATAKOSEN RAMUNE SODA L.MELON 200ML,0.2,1,3.74
LOTUS,HATAKOSEN RAMUNE,HATAKOSEN RAMUNE SODA YUZU 200ML,0.2,1,3.74
LOTUS,HATAKOSEN RAMUNE,HATAKOSEN RAMUNE SODA LYCHEE 200ML,0.2,1,3.74
LOTUS,HERSHEY,HERSHEY SOYFRESH CHOCOLATE 236MLX6,0.236,6,9.9
LOTUS,HERSHEY,HERSHEY SOYFRESH MOCHA 236MLX6,0.236,6,9.9
LOTUS,HERSHEY,HERSHEY SOYFRESH COOKIE N CREME 236MLX6,0.236,6,9.9
LOTUS,HERSHEY,HERSHEY SOYFRESH CHOCOLATE 946ML,0.946,1,5.69
LOTUS,HERSHEY,HERSHEY SOYFRESH MOCHA 946ML,0.946,1,5.69
LOTUS,HERSHEY,HERSHEY SOYFRESH COOKIE N CREME 946ML,0.946,1,5.69
LOTUS,HOMESOY,HOMESOY INSTANT ORIGINAL 10SX32G,0.032,10,8.85
LOTUS,HOMESOY,HOMESOY INSTANT MULTIGRAIN 10SX32G,0.032,10,8.85
LOTUS,HOMESOY,HOMESOY SOYA MILK 1L,1,1,3.29
LOTUS,HOMESOY,HOMESOY NO SUGAR ADDED 1L,1,1,3.29
LOTUS,HOMESOY,HOMESOY HONEY MELON SOYA MILK 1L,1,1,3.29
LOTUS,HOMESOY,HOMESOY BROWN SUGAR SOYA MILK 1L,1,1,3.29
LOTUS,HOMESOY,HOMESOY MULTIGRAIN 1L,1,1,4.99
LOTUS,HOMESOY,HOMESOY SOYA MILK 250MLX6,0.25,6,6.49
LOTUS,HOMESOY,HOMESOY BROWN SUGAR 250MLX6,0.25,6,6.49
LOTUS,HOMESOY,HOMESOY NO SUGAR ADDED 250MLX6,0.25,6,6.49
LOTUS,HOMESOY,HOMESOY MULTIGRAIN 250MLX6,0.25,6,8.89
LOTUS,HOMESOY,HOMESOY HONEY MELON 6X250ML,0.25,6,6.49
LOTUS,HOMESOY,HOMESOY NO SUGAR ADDED 3.0 946ML,0.946,1,4.69
LOTUS,HORLICKS,HORLICKS POUCH 1.65KG,1.65,1,46.79
LOTUS,HORLICKS,HORLICKS 3IN1 ORIGINAL 10SX28G,0.028,10,11.8
LOTUS,HORLICKS,HORLICKS 3IN1 CEREAL DRINKS 10SX32G,0.032,10,13.99
LOTUS,HORLICKS,HORLICKS MALT POUCH 360G,0.36,1,11.95
LOTUS,HORLICKS,HORLICKS ORIGINAL (REFILL PACK) 900G,0.9,1,21.99
LOTUS,HYH,HYH HERBAL DRINK (ORI)240MLX6,0.24,6,19.95
LOTUS,HYH,HYH HERBAL DRINK(SOURPLUM)240MLX6,0.24,6,19.95
LOTUS,ICHITAN,ICHITAN THAI BROWN SUGAR MILK 310ML,0.31,1,3.74
LOTUS,ICHITAN,ICHITAN THAI MILK COFFEE 310ML,0.31,1,3.74
LOTUS,ICHITAN,ICHITAN THAI MILK GREEN TEA 310ML,0.31,1,3.74
LOTUS,ICHITAN,ICHITAN THAI MILK TEA 310ML,0.31,1,3.74
LOTUS,IDEAL,IDEAL FULL CREAM EVAPORATED MILK 390G,0.39,1,4.9
LOTUS,IFOLIA,IFOLIA KOPI JANTAN 25GX15S,0.025,15,19.89
LOTUS,JALEN,JALEN KORDIAL ANGGUR 2L,2,1,12.9
LOTUS,JALEN,JALEN KORDIAL ROS 2L,2,1,12.9
LOTUS,JALEN,JALEN KORDIAL SARSI 2L,2,1,12.9
LOTUS,JALEN,JALEN KORDIAL BARLI 2L,2,1,12.9
LOTUS,JUS MASTER,JUS MASTER ASAM JAWA 320ML,0.32,1,1.29
LOTUS,JUS MASTER,JUS MASTER BLACKCURRANT 320ML,0.32,1,1.29
LOTUS,JUS MASTER,JUS MASTER CALAMANSI PLUM 320ML,0.32,1,1.29
LOTUS,KACIMA,KACIMA CAFE 25GX20S,0.025,20,16.65
LOTUS,KAPAL API,KAPAL API (HALUS) 180G,0.18,1,3.99
LOTUS,KAPAL API,KAPAL API INSTANT COFFEE (KASAR) 180G,0.18,1,3.99
LOTUS,KAPAL API,KAPAL API 3IN1 GULA MELAKA 18SX27G,0.027,18,12.99
LOTUS,KAPAL API,KAPAL API (HALUS) 500G,0.5,1,11.5
LOTUS,KARTA,KARTA COCONUT WATER ORIGINAL 1L,1,1,6.75
LOTUS,KARTA,KARTA COCONUT WATER ORIGINAL 330ML,0.33,1,2.05
LOTUS,KARTA,KARTA COCONUT WATER ORIGINAL 6X250ML,0.25,6,10.65
LOTUS,KICKAPOO,KICKAPOO JOY JUICE CARBONATED DRINK 1.5L,1.5,1,3.19
LOTUS,KICKAPOO,KICKAPOO JOY 320ML,0.32,1,1.55
LOTUS,KICKAPOO,KICKAPOO JOY 500ML,0.5,1,2.1
LOTUS,KLUANG,KLUANG WHITE COFFEE 3IN1 15SX40GM,0.04,15,14.5
LOTUS,KLUANG,KLUANG CAP TV KOPIO KOSONG 20SX10GM,0.01,20,7.2
LOTUS,KLUANG,KLUANG CAP TV KOPIO 2IN1 20SX23GM,0.023,20,9.8
LOTUS,KLUANG,KLUANG CAP TV KOPIO KOSONG 50SX10GM,0.01,50,14.5
LOTUS,KOPIKO,KOPIKO INSTANT BROWN COFFEE 22SX25G,0.025,22,13.69
LOTUS,KOPIKO,KOPIKO MACCHIATO 3 IN 1 24SX20G,0.02,24,11.5
LOTUS,KOPIKO,KOPIKO LOW ACID COFFEEMIX 24SX21G,0.021,24,13.69
LOTUS,KOPIKO,KOPIKO KAW 3 IN ONE 35SX20G,0.035,35,12.39
LOTUS,LE CAFE ROAST,LE CAFE ROAST MST PAPUA NEW GUINEA 100G,0.1,1,18.99
LOTUS,LE CAFE ROAST,LE CAFE ROAST MASTER BRAZIL 100G,0.1,1,18.99
LOTUS,LE CAFE ROAST,LE CAFE ROAST MASTER COLUMBIA 100G,0.1,1,18.99
LOTUS,LIPTON,LIPTON ICE TEA LMN 1.5L,1.5,1,4.6
LOTUS,LIPTON,LIPTON SERVICES TEABAGS 100S,,100,12.95
LOTUS,LIPTON,LIPTON MT MATCHA 12SX20G,0.02,12,18.69
LOTUS,LIPTON,LIPTON PACKET TEA 200G,0.2,1,6.49
LOTUS,LIPTON,LIPTON MT TEH TARIK HALIA 20GX12S,0.02,12,18.69
LOTUS,LIPTON,LIPTON MT SIGN CLASSIC 20GX12S,0.02,12,18.69
LOTUS,LIPTON,LIPTON MT TEH TARIK 20GX12S,0.02,12,18.69
LOTUS,LIPTON,LIPTON SERVICES TEABAGS 25S,,25,5.24
LOTUS,LIPTON,LIPTON YELLOW LABEL BLACK TEA 50 X 2G,0.002,50,10.25
LOTUS,LIPTON,LIPTON YELLOW LABEL TEA LEAVES 400G,0.4,1,11.75
LOTUS,LIPTON,LIPTON ICE TEA LMN 450ML,0.45,1,2.15
LOTUS,LIPTON,LIPTON ICE TEA GREEN LMN 450ML,0.45,1,2.55
LOTUS,LIPTON,LIPTON POTBAGS EXTRA STRONG P20,,20,3.49
LOTUS,LIPTON,LIPTON POTBAGS P40,,40,6.19
LOTUS,LIPTON,LIPTON POTBAGS EXTRA STRONG P40,,40,6.19
LOTUS,LIPTON,LIPTON POTBAGS P80,,80,10.45
